{
  "created_at": "2017-07-21T03:16:36.664Z",
  "created_by": "592f155746a1b867a114e010",
  "organization_id": "592f155746a1b867a114e030",
  "result": {
    "alive": true
  },
  "spec": {
    "comment": "Demo Monitor - Updated",
    "method": "eval"
  },
  "spec_type": "station/status",
  "state": "pending",
  "updated_at": "2017-07-21T03:16:36.664Z",
  "updated_by": "592f155746a1b867a114e010"
}